{
  "schema_version": "v1",
  "run_metadata": {
    "run_id": "fixture-run-001",
    "generated_at_utc": "2026-04-11T00:00:00Z",
    "market_source": "fixture",
    "embedding_model": "stub-embed-v1",
    "llm_model": "deepseek-stub-v1",
    "schema_version": "v1"
  },
  "markets": [
    {
      "market_id": "mkt-1",
      "condition_id": "cond-1",
      "question": "Will Candidate A win?",
      "description": "Election market",
      "rules": "Standard rules",
      "end_date": "2026-11-03T23:59:59Z",
      "topic": "election-2026",
      "token_ids": ["tok-a-yes", "tok-a-no"]
    },
    {
      "market_id": "mkt-2",
      "condition_id": "cond-2",
      "question": "Will Candidate B win?",
      "description": "Election market",
      "rules": "Standard rules",
      "end_date": "2026-11-03",
      "topic": "election-2026",
      "token_ids": ["tok-b-yes", "tok-b-no"]
    }
  ],
  "dependencies": [
    {
      "edge_id": "mkt-1__mkt-2",
      "edge_type": "mutually_exclusive",
      "from_market_id": "mkt-1",
      "to_market_id": "mkt-2",
      "confidence": 0.95,
      "rationale": "fixture rationale"
    }
  ],
  "baskets": [
    {
      "basket_id": "basket-mkt-1__mkt-2",
      "token_ids": ["tok-a-yes", "tok-a-no", "tok-b-yes", "tok-b-no"],
      "expected_sum": 1.0,
      "dependency_basis": ["mkt-1__mkt-2"]
    }
  ]
}
